{
  "schema_version": 1,
  "run_id": "20260822-222125-JST",
  "result": "partial",
  "primary_failure_category": "flaky_or_env_issue",
  "failure_categories": [
    "flaky_or_env_issue"
  ],
  "dimensions": {
    "task_completion": {
      "rating": "pass",
      "evidence": "PR #45のCLI接続failureを最小修正し、Focused test、Standalone／swapped control、Actual APK由来Guard、Guard後Production Runtime／Maestroを確認した。",
      "evidence_refs": [
        {
          "kind": "changed_file",
          "path": ".github/workflows/native-ci.yml",
          "selector": null,
          "event_id": null,
          "summary": "余分なpnpm CLI separatorを除去"
        },
        {
          "kind": "validation_command",
          "path": ".codex/runs/20260822-222125-JST/REPORT.md",
          "selector": "2026-08-22 23:01",
          "event_id": null,
          "summary": "修正HeadのRemote Native CIとActual APK inspection結果"
        }
      ]
    },
    "scope_control": {
      "rating": "pass",
      "evidence": "変更はWorkflowの一行、既存Contract Test、Remote実績に必要なliving documentation／Run Artifactに限定し、validator設計、Product behavior、Expo dependencyを変更していない。"
    },
    "validation_confidence": {
      "rating": "warn",
      "evidence": "G1関連のlocal／Remote validationはPASSしたが、Native aggregateはG1と独立した既存Expo Doctor patch version mismatchをfail-closeに反映してFAILした。",
      "evidence_refs": [
        {
          "kind": "validation_command",
          "path": ".codex/runs/20260822-222125-JST/REPORT.md",
          "selector": "2026-08-22 23:01",
          "event_id": null,
          "summary": "Native Static failureとG1 Guard／Runtime successの分離"
        }
      ]
    },
    "safety_compliance": {
      "rating": "pass",
      "evidence": "通常commit／pushのみを行い、force push、rebase、amend、destructive reset／clean、PR merge、retry／timeout増加、failure maskingは行っていない。"
    },
    "reviewability": {
      "rating": "pass",
      "evidence": "PR failure log、修正差分、focused／local validation、Remote job／step evidence、既存Expo Doctor failureの切り分けをRun reportとliving documentationへ記録した。"
    },
    "maintainability": {
      "rating": "pass",
      "evidence": "共有validator、Hermes decoded inspection、APK candidate extraction、Guard後Runtime依存、Maestro negative assertion、aggregate fail-closeを維持した。"
    },
    "reproducibility": {
      "rating": "pass",
      "evidence": "修正commit、PR、Remote run ID、job ID、artifact名、validator command、decoded marker結果を記録した。"
    }
  },
  "findings": [
    {
      "category": "flaky_or_env_issue",
      "severity": "medium",
      "evidence": "Remote Native CI run 32575898683のNative Static / Expo Doctorは16/17 checks passed、1 check failedで、7つのExpo patch version mismatch（@expo/metro-runtime、expo、expo-build-properties、expo-constants、expo-dev-client、expo-linking、expo-router）を報告した。",
      "detail": "G1 Guard、Actual APK inspection、Android Runtime／Maestroはsuccess。Expo dependency updateはPR #45へ混ぜず、別PRで扱う。",
      "evidence_refs": [
        {
          "kind": "validation_command",
          "path": ".codex/runs/20260822-222125-JST/REPORT.md",
          "selector": "2026-08-22 23:01",
          "event_id": null,
          "summary": "Expo Doctor mismatchとaggregate failureの根拠"
        }
      ]
    }
  ],
  "improvement_candidates": []
}
