{
  "schema_version": 1,
  "run_id": "20260910-192747-JST",
  "result": "pass",
  "primary_failure_category": null,
  "failure_categories": [],
  "dimensions": {
    "task_completion": {
      "rating": "pass",
      "evidence": "positive raw evidenceを直接調査し、30件のPostToolUse順序、absolute/compoundの完全shape、A判定、Target内canonical file identity、次の実装Planを保存した。"
    },
    "scope_control": {
      "rating": "pass",
      "evidence": "今回の変更は新Planと新Plan専用Run Artifactに限定され、source、tests、ADR、Qualification、canonicalは変更・実行していない。"
    },
    "validation_confidence": {
      "rating": "pass",
      "evidence": "Plan-onlyのMarkdown、Prettier、diff、evaluation schema、sanitizer、strict collectorを指定順で検証する。"
    },
    "safety_compliance": {
      "rating": "pass",
      "evidence": "raw evidenceを再実行せず、unapproved shapeをtrusted candidateへ昇格せず、Qualificationとcanonicalを実行していない。"
    },
    "reviewability": {
      "rating": "pass",
      "evidence": "raw Hook/stdout/stderr/analysis/metaの相対参照、時系列表、realpath/hash確認、A/B/C判定、採否境界をPlanへ記録した。"
    },
    "maintainability": {
      "rating": "pass",
      "evidence": "一般PowerShell parserやmachine固有absolute pathのhard-codeを採用せず、既存helperとinitial routing契約を再利用するPlanにした。"
    },
    "reproducibility": {
      "rating": "pass",
      "evidence": "branch、HEAD、PR、raw evidence path、Target SHA、Codex実行条件、分類順序、future Qualification条件を固定した。"
    }
  },
  "findings": [],
  "improvement_candidates": []
}
