{
  "schema_version": 1,
  "run_id": "20260820-002055-JST",
  "result": "pass",
  "primary_failure_category": null,
  "failure_categories": [],
  "dimensions": {
    "task_completion": {
      "rating": "pass",
      "evidence": "Original／Previous／Currentの3世代を区別し、d297497..f21155fのPR #34 deltaをCurrent State、Implementation Plan、新Historyへ反映した。",
      "evidence_refs": [
        {"kind": "changed_file", "path": "docs/PROJECT_CONTEXT.md", "summary": "Current Latest-main Rebaselineと3領域／Feedback Loop判断を追加した。"},
        {"kind": "changed_file", "path": "docs/history/2026-08-20_002055_agentic-qa-feedback-loop-latest-main-rebaseline.md", "summary": "delta evidenceと判断をdurable historyへ保存した。"}
      ]
    },
    "scope_control": {
      "rating": "pass",
      "evidence": "allowed_filesをCurrent State、Implementation Plan、新History、新Repair Runへ限定し、origin/main...HEADのprotected path checkでPR #34 sourceの固有差分混入なしを確認した。",
      "evidence_refs": [
        {"kind": "run_manifest", "path": ".codex/runs/20260820-002055-JST/run.json", "summary": "allowed_filesとexpected_changed_filesを固定した。"},
        {"kind": "validation_command", "path": ".codex/runs/20260820-002055-JST/REPORT.md", "selector": "2026-08-20 00:41 (JST)", "summary": "protected path filterの結果。"}
      ]
    },
    "validation_confidence": {
      "rating": "pass",
      "evidence": "format、Markdown lint、diff check、Repository verifyがPASSした。verifyはspec／curriculum、lint、typecheck、security、全test、web／spec buildを含む。",
      "evidence_refs": [
        {"kind": "validation_command", "path": ".codex/runs/20260820-002055-JST/REPORT.md", "selector": "2026-08-20 00:41 (JST)", "summary": "validation commandの実測結果。"}
      ]
    },
    "safety_compliance": {
      "rating": "pass",
      "evidence": "指定SHAをfail-closeで確認し、過去History／Run、ADR、Experiment契約、source、workflow、packageを変更していない。force／rebase／reset／amend、PR操作は行わない。",
      "evidence_refs": [
        {"kind": "run_manifest", "path": ".codex/runs/20260820-002055-JST/run.json", "summary": "scopeと安全状態を記録した。"}
      ]
    },
    "reviewability": {
      "rating": "pass",
      "evidence": "Original Historical Baseline、Previous Rebaseline、Current Latest-main Rebaselineを明示し、PR #34の実diffをTest Target／Curriculum／QA Systemへ分離評価した。",
      "evidence_refs": [
        {"kind": "changed_file", "path": "docs/plans/2026-08-17_222040_agentic-qa-knowledge-loop-implementation.md", "summary": "Historical sectionを保持したLatest-main Delta Rebaseline。"}
      ]
    },
    "maintainability": {
      "rating": "pass",
      "evidence": "新しいExperiment、Infrastructure、Validator、Workflow、Evidence Storage契約を追加せず、既存のLiving DocumentationとHistory conventionだけを更新した。",
      "evidence_refs": [
        {"kind": "changed_file", "path": "docs/history/2026-08-20_002055_agentic-qa-feedback-loop-latest-main-rebaseline.md", "summary": "最小のrebaseline history。"}
      ]
    },
    "reproducibility": {
      "rating": "pass",
      "evidence": "main SHA一致、d297497..f21155fのlog／name-status／関連diff、validation command、scope filterをRun Artifactへ記録した。",
      "evidence_refs": [
        {"kind": "validation_command", "path": ".codex/runs/20260820-002055-JST/REPORT.md", "selector": "2026-08-20 00:22 (JST) — Delta evidence", "summary": "実diff分類の根拠。"}
      ]
    }
  },
  "findings": [],
  "improvement_candidates": [
    {
      "target": "PR #32 post-push CI／最終レビュー",
      "evidence": "本RunはPR操作を行わず、push後のPhase 1 CI／Native CIと最終レビューはGitHubをCanonical Sourceとして確認する。",
      "expected_impact": "Current main rebaselineの反映後にCIとレビュー状態を正しく引き継げる。",
      "recommendation": "CIがpendingの場合は再実行やoverrideを行わず、pendingとして別途報告する。"
    }
  ]
}
